UserName,Handle,Timestamp,Text,Comments,Likes,Retweets
Budak Kayden,@caseinnintrate,2024-06-17T11:45:59.000Z,"apa hubungan merasa beriman dengan suci? apakah mengaku bahwa kita memegang imam kepada Alloh yang notabennya rukun iman pertama dianggap suci?
saya tidak menanggapi saya suci , tapi saya menganggap kaum lgbt najis. itu saja...",0,0,0
Y.G,@Kellyclan211,2024-06-17T11:44:55.000Z,bagi gw LGBT apalagi boti. ga patut di bela. itu bukan manusia tp badut jadi2an,0,0,0
தளபதிகாந்த்,@JohnKabaliDurai,2024-06-17T11:41:34.000Z,"Dei kutti kunja, LGBT na enanu enakum teriyum, adha edhukku oppose panrenu teriyum. First nee adhu enanu mulusa terinjuka. Periya liberal poolu maari pannada.",0,0,0
△,@agcv_slng,2024-06-17T11:39:29.000Z,"lah emang
yang ga boleh itu telanjang di ruang publik dan atau berbuat asusila selain di properti pribadi
lu mau bilang lgbt tertindas bakal dikebiri kalo tahuan ama negara?",0,0,0
△,@agcv_slng,2024-06-17T11:36:45.000Z,"oh lu pikir setara?
gua tanya selain lgbt, brand brand lain bantu dengan motif tersembunyi?

gini deh, koruptor biayain program makan gratis. Itu yang nerima terpaksa terima program bangga?",0,0,0
atavi,@abhicarukakrama,2024-06-17T11:35:41.000Z,"Kenapa orang yg kecanduan judi online itu rata-rata kaum homofobik ya? Gw gak pernah nemuin ada lgbt ketagihan judol, bahkan pake pinjol pun nggak. Is it just homoseks around me or?",0,0,0
SRINI SHYAM,@SriniShyam115,2024-06-17T11:33:21.000Z,Adhu LGBT..LGTV illa,0,0,0
Name cannot be blank,@tyrajspage,2024-06-17T11:32:44.000Z,budaya asli Indonesia ada jg unsur-unsur LGBT nya,0,0,0
ainnoway,@ermachhh,2024-06-17T11:24:55.000Z,Kaum lgbt sudah sepantasnya dibumihanguskan,0,0,0
Luckylucke,@Luckylucke656,2024-06-17T11:23:29.000Z,BARAKIS LGBT MON Q ++++,0,0,0
Eko Julianto,@eko_juliantoo31,2024-06-17T11:22:04.000Z,Paling best ly petik coldplay terang2 support lgbt TAPI HISAK ROKOK SEMACAMMMMM POST GAMBOR TAYANG BADAN SEGALA JENIS AURAT DGN BANGGANYA PALEBUTTTOOO,0,0,0
Ameow,@icyflak,2024-06-17T11:20:01.000Z,Lgbt mmg mental illness,0,0,0
sarski,@sarahdarshd,2024-06-17T11:07:02.000Z,"Aku tuh jujur bukan LGBT supporter tapi aku sangat menentang keras persekusi, ucapan yg menyakiti hati, dan bentuk-bentuk kekerasan HAM ke mereka. Orientasi seksual mereka adalah urusan mereka. Yg salah itu kalau udah jd kriminal, ex: ngincer anak di bawah umur.",0,0,0
Arjuna PDP,@Arjun98776999,2024-06-17T11:06:29.000Z,Tapi di agamanya juga diajarkan mengenai bersabar dengan berbagai hal yang belum dikenalnya dan harus mengenali hal tersebut lebih jauh lagi. LGBT diciptakan Tuhan sebagai ujian kita apakah kita bisa menjadi manusia yang fleksibel dan menerima perbedaan.,0,0,0
Arjuna PDP,@Arjun98776999,2024-06-17T11:04:16.000Z,Iya LGBT juga manusia mereka pasti paham apa yang dirasakan orang - orang Arab Palestina yang hidup diopresi sama Israel dan tetangga arabnya yang ikut tutup mata juga. Karena LGBT yah ikut diopresi dan paham lah mereka bagaimana klaim negatif masyarakat ke mereka. Sehingga solid,0,0,0
△,@agcv_slng,2024-06-17T11:02:26.000Z,"bayangin lo makan bakso tapi ternyata ada kaki cicak di dalem nya, kecewa nggak?

itu perasaan orang palestina nerima bantuan dari lgbt.

btw kenapa kudu labellin lgbt?

bayangin pedofil dukung komunitas lgbt?
kalo lu bangga, gua ketawa.",0,0,0
Ciana saw Taylor!,@graciaplenaxx,2024-06-17T11:01:00.000Z,Di naman sya member ng LGBT community pero matagal ng ally si Taylor? Di naman nya kelangan mamigay ng donation sa food banks pero ginagawa pa rin nya? Uso lang kase maging hater ni Taylor ngayon eh. ,0,0,0
△,@agcv_slng,2024-06-17T10:21:34.000Z,"gua setuju pembawaanya emang goblok si 
@Dragladiator
 tapi dia punya poin kalo agenda nya bukan cuma bantuan tapi juga mungkin toleransi lgbt di palestina dan mungkin timur tengah.",0,0,0
△,@agcv_slng,2024-06-17T10:18:09.000Z,ham atau toleransi lgbt dan penghianatan pada tuhan masing masing?,0,0,0
HeliosSmite,@Shinigami3333,2024-06-17T10:10:02.000Z,"Edhuku , ambala Gaaji muthi ponadhuku Reservation kekurangala  Indha LGBT la pavom T - Transgenders vena kuduklam pavom Klinefelter syndrome naala avanga kasta padranga , but indha LGB Gaaji muthunadhuklam reservation thara moodiyadhu ",0,0,0
John wick,@SteveBr28,2024-06-17T10:07:36.000Z,Romba worst bro.....enoda friends layum nerya Peru oru reason um ilama LGBT mela full hatred oda suthinu irukanunga....TN oru progressive state nu oru illusion la dhn irukom pola,0,0,0
Anak Nepotisme Ndeso,@baladatemp81441,2024-06-17T10:06:35.000Z,"Fitnah itu 
Pokoknye waspada dgn kaum sodom yakk mereka mendapatkan dana dari luar negeri untuk mencari lobang taek sebanyak banyaknya lagian iblis  setan dan dajjal itu ciptaan Allah
LGBT itu ciptaan spa ?",0,0,0
elena (katezuwoe),@shafaasgirl,2024-06-17T10:00:03.000Z,njirr lgbt coeg :v,0,0,0
Crypto model,@bitcoin_modelN,2024-06-17T09:56:58.000Z,LGBT ,0,0,0
△,@agcv_slng,2024-06-17T09:55:50.000Z,"anecdotal lo ga penting banget.

kalo mereka mau bantu kenapa kudu branding lgbt gua tanyak?",0,0,0
DFortin,@DFortinOficial,2024-06-17T09:54:38.000Z,Lgbt?,0,0,0
Ade Rusmana,@AdeRusmana20058,2024-06-17T09:53:41.000Z,LGBT lu,0,0,0
Ava,@smittenmuch,2024-06-17T09:53:35.000Z,"Sedikit heran di sini banyak yang judol, tapi gue ga pernah liat ada yang bawa bawa nanti bakal bencana lah tempat maksiat lah apa lah. Coba kalo tempat seks bebas atau lgbt, pasti udah panjang lebar sampe bawa bawa kiamat.",0,0,0
△,@agcv_slng,2024-06-17T09:52:58.000Z,"bantu bantu palestina aja tanpa brand branding, kesannya jadi narasi biar di toleransi lgbt di timur tengah.",0,0,0
Ade Rusmana,@AdeRusmana20058,2024-06-17T09:52:16.000Z,Akun LGBT,0,0,0
△,@agcv_slng,2024-06-17T09:51:08.000Z,"murni kemanusiaan tanpa narasi toleransi lgbt di dunia timur tengah?
jangan naive, blackstone punya agenda.",0,0,0
sean,@lightbringer_13,2024-06-17T09:39:37.000Z,terdeteksi lgbt mungkin sama pemerintah :(,0,0,0
真剣で私に恋しなさい！,@robin_sage19,2024-06-17T09:31:30.000Z,LGBT,0,0,0
Muhammad Sumbul,@Virqy_Apriyadi,2024-06-17T09:21:07.000Z,"Kalau dalam Islam yang halal itu yang mengompori / provokasi buat orang lain jadi LGBT, setau gw gitu sih, cmiw",0,0,0
J,@hoknage,2024-06-17T09:16:29.000Z,Like kalo kalian lgbt (lagi bete),0,0,0
Michael Angelo Iskandar HQ,@ErenyuhHQ,2024-06-17T08:58:24.000Z,"projekting mulu emang pdf file, gk ada kaitan ama lgbt padahal",0,0,0
Pribumi Belum Merdeka,@shupesyaru,2024-06-17T08:52:58.000Z,"Mengapa menyedihkan bagi kaum munafik dan kapir? 
Karena Minangkabau mengisolasi diri dari:
- Minuman keras
- Judi
- Zina
- LGBT
- Sekularisme
- Kemusyrikan.",0,0,0
erbil,@erbil_polat,2024-06-17T08:52:00.000Z,Tamam sena en lgbt sensin,0,0,0
｀kai . ★,@cru3llwrld,2024-06-17T08:23:55.000Z,"gw cuma pengen pernyataan dr tweet org kedua yg bilang kalau komun lgbt mendukung palestina tp memiliki maksud lain, kek gw reply gitu tuh gk maksud kok bisa pemikirannya begitu",0,0,0
Harahap fams,@MaskuddinH,2024-06-17T08:21:01.000Z,Gila idf emang lgbt kebanyakan ha ha,0,0,0
ian,@oartmilk,2024-06-17T08:17:55.000Z,"Tags: bxb , lgbt , profanity , etc 

Warning 
– top! Esan bot! Iyan 
– area bxb please kalau merasa bukan ur cup of tea boleh diskip 
– ship taeshan as lover 
– jangan salah lapak ya 
– i did writing for fun 

Enjoy",0,0,0
ron,@dnshbaron,2024-06-17T08:17:01.000Z,"Astagfirullah, kam bagian lgbt ya.",0,0,0
Yogi Natasukma™,@SoundOfYogi,2024-06-17T08:11:29.000Z,"Pedo jelas salah

Lah LGBT salah dimananya?",0,0,0
Eddy Ashabul Maranggi,@Abuthoh,2024-06-17T08:07:01.000Z,Geng lgbt ni elok jadi pengilap kasut aku je.,0,0,0
#Njf-le mans 787b,@Elon_Bunnies,2024-06-17T08:05:32.000Z,"Betul. Pelaku LGBT sedikit lebih tinggi kehormatan nya kalau di bandingkan dengan Pedo (karena LGBT dapat diampuni jika mengakui kesalahannya) namun kalau mereka tidak mau mengakui kesalahannya+hukum negara ini memungkinkan, Mereka pantas untuk dihukum mati.",0,0,0
esmeralda,@nisawayne17,2024-06-17T08:00:41.000Z,+ lgbt bayragi,0,0,0
Yogi Natasukma™,@SoundOfYogi,2024-06-17T07:57:00.000Z,"No it's not, fobia gak ada yang normal mas,apalagi menyamakan LGBT dengan Pedo, itu jelas tanda2 kekurangan protein otak XD",0,0,0
"Dhian_Phut, MSi., MSs.",@Alle_ex_Xander,2024-06-17T07:53:02.000Z,Oh... Br ngerti kl lo LGBT,0,0,0
bor,@DoembaGurun,2024-06-17T07:52:05.000Z,"Astaghfirullah, sex bebas, makin banyak orang ateis, lgbt, perempuan banyak yg melacurkan dirinya, na'uzubillahiminzalik",0,0,0
Jack Jacks,@ThashJack,2024-06-17T07:45:37.000Z,Jamaa ni league ya LGBT,0,0,0
Denji Siregar,@peinakatsukiss,2024-06-17T07:44:50.000Z,Lagi ga 1/2 idol yang rekomen/emang pernah nonton film lgbt kali,0,0,0
アルダちゃん,@aldapstsr,2024-06-17T07:42:01.000Z,kursi lgbt,0,0,0
Nah just normal poeple,@BarunaKoda,2024-06-17T07:35:13.000Z,"LGBT itu licik bro, mereka berani merevisi buku dan mempromosikan lgbt di sekolah dan kartun anak"" Termasuk buku mereka ingin dianggap normal Dan diterima di kalangan masyarakat jadi mereka memutar balikkan fakta",0,0,0
Amin Golden,@amingolden_,2024-06-17T07:27:20.000Z,"Kir to LGBT  

Faqat timarestaniaro azad kardan donya beham berize 

Yeki yeki ina bayad darman beshan ya koshte beshan 

TAMAM",0,0,0
michael myers,@seyfo2834,2024-06-17T07:22:53.000Z,Kes sesini amk lgbt sevicisi,0,0,0
𝐻𝒶𝓇𝒾 𝒜𝒦 𝑅𝒶𝓈𝒾𝑔𝒶𝓃ᴺᵒ ᴳᵘᵗˢ ᴺᵒ ᴳˡᵒʳʸ,@Harimsdh,2024-06-17T07:20:55.000Z,Coimbatore la nadantha lgbt organiser eh nee thana da kuthi,0,0,0
HlZLl TV,@TvHizli,2024-06-17T07:18:53.000Z,LGBT vergisi ,0,0,0
liey,@Liey_meh,2024-06-17T07:12:42.000Z,Selamat datanv dikota pusat lgbt,0,0,0
Toko Toko,@TokoTok73591354,2024-06-17T07:00:19.000Z,"Ini kaum tulang lunak..
Evertabrata juga...

Kalau di kelompokan dalam termasuk kedalam KAUM LGBT (PENYULA LOBANG TAIK)
kerjanya nyusain ortu doank",0,0,0
bintang,@bingungtanganga,2024-06-17T06:57:58.000Z,"""Emangnya dia bakal nikah? Dr gayanya sih bakal sonde nikah sih""
""Kamu punya pacar? Sonde pernah keliatan sama lelaki sih""
Ini kalimat celoteh dokter usil dr pagi td terngiang trus ampe sekarang. 
Keknya b harus branding lgbt biar jan dinyinyirin.",0,0,0
ibu-ibu agak muda,@ratihjayanti,2024-06-17T06:54:24.000Z,"Netflix nek ora digae lgbt samar nek oposih, ampun. Wis fransesca diganti, isih lesbi neh ",0,0,0
Roti Unyil,@otiunyil,2024-06-17T06:48:52.000Z,Mungkin hotelnya punya divisi radar lgbt spesialist,0,0,0
Habibi_Brijik,@muslimsoleh_,2024-06-17T06:25:16.000Z, mending kembangbiakin aj lgbt dsana biar jd wisata wkwk ngerii,0,0,0
A,@azzemeong,2024-06-17T06:14:38.000Z,Jateng lgbt (lasem grobogan blora tegal),0,0,0
Brolil,@thenexthotman,2024-06-17T06:08:38.000Z,"emang tai lgbt itu, temennya cewe gw deketin cewe gw dan ternyata dia lesbi. akhirnya cewe gw langsung cut off itu orang.",0,0,0
Karol,@Karolekpolak44,2024-06-17T06:04:43.000Z,Jebac lgbt jebac jebac jeeeebac,0,0,0
Italo,@ivrea132435,2024-06-17T06:03:29.000Z,Solo i preti lgbt.,0,0,0
Fattichar Jakhmare (Fulham Fan),@Informaticafan,2024-06-17T06:02:38.000Z,Kal dopahar ka (sunday),0,0,0
Pedrinism,@bolehnakalkan,2024-06-17T06:00:08.000Z,posting lgbt juga lancar ya,0,0,0
尺卂ﾌ ᐯ|ﾌ卂ㄚ𓃵,@RajVijay197406,2024-06-17T05:59:13.000Z,Nee LGBT ah maarugiratha naanga ellam unargirom,0,0,0
Zionism is Terrorism,@SB_Official18,2024-06-17T05:58:56.000Z,Sadiq Khan LGBT aur same sex marriage ka supporter hai. Sadiq Khan  labor party sy hai. Is party ny iraq main lakhon Muslims ko shaheed Kiya tha. Election jeetny ky Baad Sadiq khan ny hindu temple main sar jukaya tha. Agar IK us waqt Sadiq Khan ko support karta tu aj bhi ap log,0,0,0
愚父ぃ　さま,@Bang_guffy,2024-06-17T05:51:25.000Z,"Aplikasi lain juga woke, lu ketik anti LGBT di Instagram aja di ban jukenberg",0,0,0
Ra,@rarirukoy14,2024-06-17T05:46:35.000Z,"kaak iya banget, aku ni trmasuk yg selalu skip disc, jd prnah ngalamin baca AU ((bukan AU bangtan kebetulan)) udh smpe tengah2 eh ternyata OC nya tuh lgbt di AU ceritanya gtu trus prnah juga yg trnyata bxb  kayak bjir moment ajasi waktu aku kebuang sia2 bgt",0,0,0
srakunpl,@szymn123,2024-06-17T05:42:45.000Z,Lgbt,0,0,0
Joseph Kiyotaka,@koitsuwaningen,2024-06-17T05:36:15.000Z,Logika yang sama applied ke komunitas LGBT dg agama. Ga mungkin agamis diem pas ada orang gay ngesegss depan mereka,0,0,0
Profokiev || The Acolyte Era,@Profokiev,2024-06-17T05:35:54.000Z,Okay fine di incest itu ada banyak faktor genetik bisa terganggu. Ada faktor sosial jg terkait power dynamic yg berbeda dgn lgbt dah tuh monggo direnungkan wkwkwk,0,0,0
-,@wolverwinnn,2024-06-17T05:28:16.000Z,"sumpah kecewa bgt kalo bridgerton ngerilis season lgbt. maksudku khusus bridgerton family. sumpah, w langsung berhenti nonton bridgerton walaupun saya adalah fans berat series tersebut.",0,0,0
Rope Money,@taliwang98,2024-06-17T05:15:39.000Z,"Ya elah si t0l0l. Dari dulu yang dukung Palestina dan menghujat Islamophobia di negara barat itu kelompok lgbt kali. Lu mikirnya cetek karena di Indonesia mayoritas pasti dukung Palestina, sedangkan muslim di negara barat itu minoritas. Ga didukung kelompok lgbt kelelep tuh isu.",0,0,0
park_choi,@park_choyy,2024-06-17T05:07:24.000Z,"LGBT kalo udah cemburu emang gitu, biasanya mutilasi, tumben yg ini ngga",0,0,0
JISHNU,@____JISHNU,2024-06-17T05:06:49.000Z,Lgbt??,0,0,0
雅思敏,@ysmnezahari,2024-06-17T05:06:05.000Z,"Artis luar buat concert sini cakap lgbt la zionist la, tetiba siti nurhaliza buat concert ramai pulak backup.",0,0,0
Wildman Steve,@TheWildmanSteve,2024-06-17T05:04:48.000Z,LGBT,0,0,0
Mr'O,@Robiana2371,2024-06-17T05:03:20.000Z,"Muka"" LGBT semua wkwwk",0,0,0
mars suspicious thing,@bukenvira,2024-06-17T05:03:11.000Z,kecewa. berat. bridgerton. knp. hrs. ada. lgbt. fak anjir,0,0,0
ti,@kimamuya,2024-06-17T04:52:46.000Z,demi apa bangun tidur lemes banget krna abis mimpi aneh dilecehin sm kuntilanak anjjjknp harus hantu dan kenapa hantunya lgbt takut bgt,0,0,0
Manchild24,@DaniManchild24,2024-06-17T04:50:01.000Z,"biasanya tatto arm band garis2 itu define as equality/same love, populer juga dikalangan LGBT…begitu..",0,0,0
Kakak 2,@Kakak211,2024-06-17T04:41:10.000Z,"Ente lihat sendiri, secara literal LGBT dibolehkan dalam Islam, tertulis dalam Qur'an dan hadits. Dipraktekkan sendiri oleh muslim, bahkan Muhammad dalam hadits. Ane tidak berspekulasi atau memfitnah. Bahkan beberapa Khalifah Abbasiyah Islam adalah LGBT",0,0,0
tih,@bopungPWT,2024-06-17T04:38:25.000Z,"Pacaran, lgbt, dah dah sebut semua ni, judol juga janlup",0,0,0
𖤍 ‧⁺siluman manusia ‧₊☽⁺⋆,@homudaemon,2024-06-17T04:33:58.000Z,lucu itu ketika tempo memasukkan syarat lomba enggak boleh ada unsur LGBT dalam karya cerpen di posisi yang sama dengan unsur sara dan pornografi,0,0,0
Ishimwe Imran R. Ashraf,@smith_rajibk,2024-06-17T04:28:45.000Z,Insha Allah,0,0,0
vayy,@loadedgurl,2024-06-17T04:25:44.000Z,"temen ku ga berubah si kak, but sometimes dia mandang aku aneh gitu, terus selalu berpikir kok bisa suka sm BL  paling males kalo ad org yg lg ngomongin lgbt, pasti mereka nyinggung aku -_- maksudnya ma bercanda, tapi tetep ga suka kadang ",0,0,0
あめ,@NandeBapakuKaro,2024-06-17T04:20:52.000Z," lu pikir cuma dia yg ngaku² gt? 

lgbt hukumnya asingkan ato rajam sampe mati pir sama kyk zina",0,0,0
flutterflake,@sonyaseptianii,2024-06-17T04:15:52.000Z,"*BRIDGERTON S3 SPOILER ALERT*

ksl ya sama netflix kaya mesti bgt ada unsur LGBT di series2nya liat aja S3 ini bisa pula tbtb abgnya jd bi LOL 
kaya ga sah apa kalo semua pada straight???",0,0,0
M Miftahul Firdaus,@miftahspara,2024-06-17T04:11:38.000Z,"""Civilized Sexual Morality and Modern Nervous Illness"" adalah tulisan Freud yg paling perlu di-address karena isinya secara harfiah menyamakan kebahagiaan dg sex dan menganggap restriksi peradaban & moral atas sex sebagai ketidakbahagiaan. Ini berpengaruh ke gerakan SJW, LGBT dll",0,0,0
Errrrl,@_yourbubu,2024-06-17T04:07:58.000Z,eh ini serius joko anwar nyelipin lgbt di filmnya?,0,0,0
Heartnebula,@boringbreaker,2024-06-17T04:03:04.000Z,Tergantung. Emang kamu ngapain bang? Korupsi? Mencuri? Judol? Atau LGBT?,0,0,0
Orang Binasa,@Raisal_P,2024-06-17T04:00:35.000Z,mohon arahkan saya ke komunitas LGBT/queer yang dukung Ukraine ,0,0,0
あめ,@NandeBapakuKaro,2024-06-17T03:56:58.000Z,"Aku kan ngutip kata² lu, si mumtah kan kalo ngoceh berdasar sumber studi penelitian ilmiah 

Ten, dlm Islam lgbt itu hukumnya diasingkan  ato hukum mati  yg lu bikin foster itu udh basi fitnahnya ",0,0,0
RicInj,@rickyindra32837,2024-06-17T03:53:42.000Z,"Cuma cukup berhati hati aja kalo mau bergaul sm org lgbt, kasus HIV aids meningkat di tahun 2024 jaga diri aja. Cek pencegahan agar tidak tertular.",0,0,0
orang ya(ng)hoodie,@waltuhamogus,2024-06-17T03:47:03.000Z,"Jangan salah bang, mereka juga rame kok ngomongin ukraine

Makanya kelompok sayap kanan barat selalu ngejek2 kelompok leftist pake ejekan bendera lgbt dan ukraine",0,0,0
ael,@kimichaelgyu,2024-06-17T03:36:51.000Z,"Tolol. Bikin cerita tanpa persetujuan orang yang dipake untuk visualnya aja udah melanggar hak etik, apalagi ini dijadiin cerita pemuas imajinasi lgbt lu sendiri pake segala narasi warn homophobic jan salpak",0,0,0
"۝༒ⒷⓁⓄⓄⒹ࿐ⒶⓁⓟⒽⒶ༒۝, 戀•𝖆𝖘𝖙𝖆𝖊𝖑•戀 ✞︎ʙᴀᴅꨄ︎ʙɪᴛᴄʜシ︎",@Liliajakbar,2024-06-17T03:34:23.000Z,NGAKAK FANDOM LGBT,0,0,0
NullPointerException,@throwsnpe,2024-06-17T03:26:42.000Z,Kena azab sih itu. Lagian lgbt kan emg penyakit mental jd wajar aja banyak yg depresi trus gantung diri gitu. Kasian pemilik kosannya jd kena akibatnya kaum lgbt miskin itu ya,0,0,0
Anggap aja PNS,@TakaTricky,2024-06-17T03:25:06.000Z,Jaman sekarang juga makin banyak yang sebenarnya sudah ada dalil tapi masih ngebut dipelintir. Contohnya: lgbt,0,0,0
NullPointerException,@throwsnpe,2024-06-17T03:25:04.000Z,Ya gimana kaum lgbt kan emg sakit mental semua,0,0,0
Domdom,@Domdom423249111,2024-06-17T03:16:55.000Z,"Bahwa tindakan Bundir adalah yang di benci Tuhan!
Kematian itu seperti pencuri kita tidak tahu bagaimana dia datang .
Pikirkanlah hari tersisa apakah kita masih sempat melihat esok?

#gayindonesia
#gaylokal
#gaymedan
#lgbt",0,0,0
biru ᮘᮤᮛᮥ,@ipoprules,2024-06-17T03:14:33.000Z,homofobik sok tau dan cetek pemikiran asal bunyi doang terus-terusan ngomong sembarangan soal komunitas lgbt mulu tuh jahat bgt sih. apakah kita tidak lelah???,0,0,0
₩₩₩.T@.COM,₩₩₩.T@.COM,2024-06-17T02:17:32.000Z,"taik njing  fir...al quran melarang LGBT njing..

kaom kao yg menyetujuLGBT..",0,0,0
Fiq | Stand with,@Gembloenk69,2024-06-17T02:17:27.000Z,"Logika anda semrawud bro, justru karena kami LGBT jadi korban diskriminasi,kebencian dan kekerasan ikut merasakan terhadap sakit yang dirasakan korban di Palestina",0,0,0
伊助,@sOGIGQVZgJLUUlg,2024-06-17T02:08:12.000Z,LGBT,0,0,0
✶,@wchisper,2024-06-17T02:04:06.000Z,"terserah lu aja dah, berlindung dibalik jurnal yang ga make sense dan banyak kontra sama jurnal itu, dan lu nemu sourcenya dari negara jerman, yang emang pro lgbt, kalo u mau nyari sumber tu dari negara yang netral tolol, gue juga bisa ngekontra SSan u itu pake source",0,0,0
XAVERIUZ Algenoa,@AlgenoaXaveriuz,2024-06-17T02:02:26.000Z,"BaDuT"" Mesjid DuNgU Alergi sama LGBT kan? tp aLeRgy Ga sama Pedofilia? pasti Jawaban ny Idiot neh krn nabi PedopiL pujaan ny mencontohkan itu & Dibilank TeLADaN terbaik Seluruh Umat Manusia, munafik Pathetic ",0,0,0
jofleta,@pacosqlios,2024-06-17T01:58:27.000Z,Un poco lgbt tu ly,0,0,0
Rusdi Anto,@rusdi5294,2024-06-17T01:55:15.000Z,Saya mendukung untuk lgbt di indonesia segera di bunuh semuanya ,0,0,0
J,@joypabloo,2024-06-17T01:43:43.000Z,"wkwkwkwk, ada lgbt detector di pintu",0,0,0
Rat-ion-al,@ion_rat,2024-06-17T01:21:55.000Z,LGBT+++ ,0,0,0
Choco,@ChocoLatte7599,2024-06-17T01:12:25.000Z,Monsta macam puki babi gi selit lgbt dalam BoBoiBoy,0,0,0
Octavianus Bedanaen,@oyun2418,2024-06-17T01:02:57.000Z,"Letoy,,,,kaum LGBT",0,0,0
Dedi Wahyudi,@DediWah78721333,2024-06-17T01:02:35.000Z,Yesus di salip karena ketahuan LGBT,0,0,0
Aldi sdang ap?,@aldinyakamuu,2024-06-17T01:02:17.000Z,lgbt,0,0,0
riina です,@korewa_rindesu,2024-06-17T00:41:58.000Z,Pantes tantrum banget di sebut2 LGBT soalnya masuk dalam kelompok warna warni ,0,0,0
carh,@carh_npc,2024-06-17T00:41:08.000Z,"Dia kan gay kwkwkkw... Makanya begitu, karena di Indonesia tidak bisa LGBT kwkwkkw",0,0,0
NullPointerException,@throwsnpe,2024-06-17T00:22:58.000Z,Asal mulanya ya krn dari kaum gay goblok itu blok. Resiko tinggi itu ya dr kaum lgbt miskin itu,0,0,0
Wish You Hell,@todayis_gloomin,2024-06-17T00:22:44.000Z,Nanti ada mas mas berjubah hitam datang menghampiri tempst tinggal anda untuk melihat apakah anda benar2 lgbt atau bukan,0,0,0
biya,@fourthnt,2024-06-17T00:19:53.000Z,wadu ustadz rumah gue bahas ttg lgbt diceramahnya,0,0,0
𝘼 𝙅.𝘽𝙝𝙖𝙧𝙖𝙩𝙝,@logintoAJ,2024-06-17T00:18:04.000Z,lgbt ya solraru ,0,0,0
Kirana,@txtfromkirana,2024-06-17T00:15:49.000Z,"Kaum gay LGBT ini makin meresahkan anjir, mana terang terangan banget sekarang dg bangganya pamer di sosmed",0,0,0
死の外科医,@Nandy_Aprian,2024-06-17T00:08:46.000Z,Yg starwars ada yg soal modernisasi game juga ada cari aja twit dia yg Harvest moon remake ada lgbt,0,0,0
lgbt doug bowser,@dancommadirty,2024-06-17T00:08:12.000Z,gang gang gang gang,0,0,0
Flamehand009,@Hayland009,2024-06-17T00:05:54.000Z,"Nyari pengakuan dari seseorang yg gk jelas jenis kelaminya, pria mirip betina. APA konten buzzer satu sekarang beralih ke Proganda LGBT???",0,0,0
dill,@eskecombrang,2024-06-17T00:05:43.000Z,"w jarang bgt dengerin khotbah, sekalinya dengerin bahasnya tentang lgbt ajg  langsung gamood",0,0,0
Verysuperbased,@verysuperbased,2024-06-16T23:58:08.000Z,lgbt flag,0,0,0
Pemerhati Yan Skibidi,@krispiiiiii,2024-06-16T23:57:42.000Z,Ckckck agenda lgbt emg sampah bgt,0,0,0
Uden Surahman,@ud44241,2024-06-16T23:53:36.000Z,"Ironis bencana kemanusiaan .HAM ,Demokrasi cuma produk kampaye picik.Amerika dn Barat CS.dgn Lgbt nya.apakah ada yg salah dgn Hati Manusia Normal ? ..",0,0,0
milk,@imilk,2024-06-16T23:47:59.000Z,GAKPAPA:3 yang penting sapphic/lgbt,0,0,0
Jerry,@purplefly_paw,2024-06-16T23:41:07.000Z,"Serius nanya temen kerja gw ada yg lgbt juga mau cewe ato cowo
Terus temen2 yg lain pada bilang kalo darah mereka itu halal
Beneran kah?",0,0,0
Yeinn Yeinn,@YYeinn32309,2024-06-16T22:53:38.000Z,Pemain bokep gay.. artis lgbt..bgtulh .mf yh bukn mjlkkan..tpi itulh fakta kehidupan ini,0,0,0
Matthew,@MatthewCzar,2024-06-16T20:12:05.000Z,lgbt=pedophilia,0,0,0
Aruna Mafela,@aruna_mafela,2024-06-16T20:09:34.000Z,skang ni coldplay malam tadi takde pun LGBT kau merapu ke apa skang pas konon islam tp takde halang konsert laki pompuan bercampur jadi pas ni liberal ke kau ni teruk sgt tunggang islam weh,0,0,0
merahputih88,@is68092645,2024-06-16T20:01:09.000Z,LGBT..,0,0,0
aslan,@aslan2290011440,2024-06-16T19:58:03.000Z,Kaum lgbt LAKNATULLAH,0,0,0
Gürhan Adsız,@GurhanAds,2024-06-16T19:50:07.000Z,LGBT geldi AMK,0,0,0
ismenvedat,@ismenvedat,2024-06-16T19:48:15.000Z,Lgbt ,0,0,0
Nabil Rahman,@ztcbangbang,2024-06-16T19:24:54.000Z,"awak yg sokong peliwat ni mcm mana pulak?? kaki jilat bunga lawang jugak ke cm mana, muka ada iras iras lgbt dh tu",0,0,0
Ron,@Ronaldchristy,2024-06-16T19:20:01.000Z,"Kan ngak diajarkan agama yg mengajarkan harus membenci minoritas, yahudi, Amerika, LGBT, dan berusaha sekeras2 membela kehebatan kaum sendiri.",0,0,0
Taurus,@MahardianTaurus,2024-06-16T19:11:36.000Z,G usah pada kepo . G lama kemudian.. yg G suka sama Lgbt mesti Bakal Koar koar share... Udhlah.. percuma.. nanya nanya.. yg jls.. buat pengalaman aja.. dn didoakan adalah hadiah yg tepat ...,0,0,0
𐙚YE˙⋆.˚,@BakerVerze,2024-06-16T19:10:07.000Z,LGBT WHAT??? PANON COKLAT KOPI SUSUUUU,0,0,0
gay hashira bunty,@kooboybipop,2024-06-16T18:58:46.000Z,kolkata,0,0,0
Hasanudin,@hasanudinsajid,2024-06-16T18:57:12.000Z,"Euro 2024, menggiring opini seolah para LGBT sdg berkompetisi Bola, jadi mengurangi Kenikmatan menontonnya, entahlah...",0,0,0
"phantom, prometheus",@pseudo_mgnmopus,2024-06-16T18:56:12.000Z,"Kadang sedih sih ketika di kebanyakan waktu dan kesempatan, LGBT masih lebih identik dengan gay (atau kadang lesbian). Padahal spektrumnya masih jauh lebih luas dari itu",0,0,0
bung jarot,@bungbeje250,2024-06-16T18:45:41.000Z,"Namanya Juga Tentara LGBT, Beraninya Sama Perempuan Dan Anak Kecil",0,0,0
outlaw nunu,@glenn_nunu,2024-06-16T18:32:14.000Z,"jerman karena klub2nya & pemainnya banyak yg moncer di ucl & uel 

*dg catatan fokus di bola jangan aneh2 kayak waktu pildun 2022 dukung lgbt",0,0,0
rawis!,@spnozzz,2024-06-16T17:50:09.000Z,Di Indonesia lebih susah memperjuangkan hak kaum LGBT atau kebebasan bertuhan?,0,0,0
akang kendang,@kucing_orenge,2024-06-16T17:45:07.000Z,Dah kayak pelaku LGBT,0,0,0
naa- CEK PINNEDDD LOHH,@damnn4f,2024-06-16T17:34:42.000Z,kalau sm ak boleh lgbt ,0,0,0
,@iam_ae,2024-06-16T17:33:21.000Z,"Daddy: Wala namang LGBT sa lahi natin

 DI KAYO SUUURE HAHAHAHAHAHA",0,0,0
ANTI NU (NETANYAHU UNITED),@BUZZERPSSIASU,2024-06-16T17:30:09.000Z,Wkwkwkwk..pemikiran kaum goblok dan tolol (LGBT) ... MENDING LGBT NGENTOT SAMA HEWAN AJA ..WKWKWK .OTAKNYA ISI TAI..MAKANYA GA NORMAL...CHUUAAKSSS,0,0,0
MIKE VI,@elmaalik87,2024-06-16T17:24:10.000Z,"Salafiste pro LGBT 
Domou koutou mbassane  moy wakh wakhou dof yi",0,0,0
Rendrillio Galiardra,@brightrice_,2024-06-16T17:19:17.000Z,"bye duolingo, yakali cok soal percakapan tiba tiba ada cewek kenalin pacarnya ke ibunya dan pacarnya juga cewek, alias lgbt taik dahlah gw hapus",0,0,0
Padang Savana,@theovertureofme,2024-06-16T17:09:12.000Z,"Takbiran tapi JJ (jedag jedug)
are you kidding me?
Emang naluri kalian tuh naluri bocah dugem, cuman kebetulan kalian bocil kabupaten aja
Kyak gitu kalian gamau disebut generasi dgn degradasi moral
Tapi kalian keep mocking LGBT sbg org2 dgn kemrosotan moral
Najong tralala klen",0,0,0
kayyez noimi,@Kzonna889,2024-06-16T17:08:34.000Z,Muka lgbt wkkkkkk najis wa,0,0,0
Andrew Sinaga,@AndrewSinaga9,2024-06-16T17:04:04.000Z,"Sangat banyak manfaatnya paparan ibu Dokter 
@DrEvaChaniago
 pada kita semua agar waspada pada efek lgbt !",0,0,0
